{
  "source": "weather",
  "version": 1,
  "fetchedAt": "2026-10-26T09:00:00Z",
  "stale": true,
  "data": {
    "observedAt": "2026-10-26T13:30:00Z",
    "weatherCode": 3,
    "cloudCoverPercent": 100,
    "precipitationMm": 0.0,
    "windSpeedKmh": 9.4,
    "isDay": true,
    "temperatureC": 23.5
  }
}
